{
  "schema_id": "naturalcontrol.actuation_receipt.v1",
  "spec_version": "1.0",
  "epoch_ns": "1742050000012000000",
  "receipt_id": "receipt-001",
  "bundle_id": "bundle-011",
  "request_id": "req-click-001",
  "interaction_id": "interaction-blueclicker-001",
  "execution_id": "exec-001",
  "surface_kind": "mouse",
  "receipt_state": "emitted",
  "adapter_ref": "adapter/uinput-v1",
  "emitted_atom_count": 3
}
